{
  "schema_version": "1.0.0",
  "id": "unknown_damage_stack_001",
  "question": "Is the observed 30 to 40 damage change produced by a flat bonus or a rounded multiplier?",
  "type": "OBSERVATIONALLY_EQUIVALENT",
  "evidence_ids": ["ev_damage_011", "ev_damage_019"],
  "claim_ids": ["claim_damage_stack_004"],
  "what_is_known": "Both candidate rules reproduce every observed non-critical hit in the supplied footage.",
  "what_is_not_known": "The original operation and order relative to unobserved modifiers cannot be identified.",
  "baseline_resolution": "Use model_damage_flat_001 as the minimum-complexity baseline choice and retain the multiplier candidate.",
  "risk": "Future unseen upgrade combinations could diverge from the original."
}
